{
  "schema": "prompt-quarry-human-review-v1",
  "review_id": "review-50430774b95d10191542",
  "candidate_id": "cand-50430774b95d10191542",
  "candidate_fingerprint": "sha256:6952497f7747f9e972c3bf101edf6cbbee1ebdcb6a93e8d9cd08badab3355908",
  "policy_version": "1.1.0",
  "reviewer_role": "human-owner",
  "decision": "HOLD",
  "decision_reason_codes": [
    "PENDING_HUMAN_DECISION"
  ],
  "rationale": "Pending human review; replace this placeholder with the review rationale.",
  "reviewed_at": "1970-01-01T00:00:00Z",
  "machine_confidence_at_review": 0.88,
  "machine_route_at_review": "HUMAN_REVIEW_REQUIRED",
  "corrections": [],
  "source_commit": null
}
