{
  "schema": "prompt-quarry-human-review-v1",
  "review_id": "review-166c5ffccfc3ea7f4ed3",
  "candidate_id": "cand-166c5ffccfc3ea7f4ed3",
  "candidate_fingerprint": "sha256:14d97dfeaa720dde518a083d1771b5154eb1f227f52d9ee388cccae6128fff86",
  "policy_version": "1.1.0",
  "reviewer_role": "human-owner",
  "decision": "HOLD",
  "decision_reason_codes": [
    "PENDING_HUMAN_DECISION"
  ],
  "rationale": "Pending human review; replace this placeholder with the review rationale.",
  "reviewed_at": "1970-01-01T00:00:00Z",
  "machine_confidence_at_review": 0.915,
  "machine_route_at_review": "HUMAN_REVIEW_REQUIRED",
  "corrections": [],
  "source_commit": null
}
