{
  "schema": "prompt-quarry-human-review-v1",
  "review_id": "review-397b0cd3cf5cd632c2c4",
  "candidate_id": "cand-397b0cd3cf5cd632c2c4",
  "candidate_fingerprint": "sha256:6ccb92605eddb6874da6d0a208c13899d680d952753fe1520bbc2c1d719b0126",
  "policy_version": "1.1.0",
  "reviewer_role": "human-owner",
  "decision": "HOLD",
  "decision_reason_codes": [
    "PENDING_HUMAN_DECISION"
  ],
  "rationale": "Pending human review; replace this placeholder with the review rationale.",
  "reviewed_at": "1970-01-01T00:00:00Z",
  "machine_confidence_at_review": 0.915,
  "machine_route_at_review": "HUMAN_REVIEW_REQUIRED",
  "corrections": [],
  "source_commit": null
}
