{
  "schema": "prompt-quarry-human-review-v1",
  "review_id": "review-699b4ef63ceb70d96b70",
  "candidate_id": "cand-699b4ef63ceb70d96b70",
  "candidate_fingerprint": "sha256:bd6ca92bf6629892a5294d9d59d8abb9e3868fdaa0c5fb510d8eda0965b38617",
  "policy_version": "1.1.0",
  "reviewer_role": "human-owner",
  "decision": "HOLD",
  "decision_reason_codes": [
    "PENDING_HUMAN_DECISION"
  ],
  "rationale": "Pending human review; replace this placeholder with the review rationale.",
  "reviewed_at": "1970-01-01T00:00:00Z",
  "machine_confidence_at_review": 0.92,
  "machine_route_at_review": "HUMAN_REVIEW_REQUIRED",
  "corrections": [],
  "source_commit": null
}
