{
  "schema": "prompt-quarry-human-review-v1",
  "review_id": "review-d22cf679ea40ab4d49a7",
  "candidate_id": "cand-d22cf679ea40ab4d49a7",
  "candidate_fingerprint": "sha256:e64ea213e9b14d6b90537a1e0a7c78ebed390fd091fe1707ca7837016d624bae",
  "policy_version": "1.1.0",
  "reviewer_role": "human-owner",
  "decision": "HOLD",
  "decision_reason_codes": [
    "PENDING_HUMAN_DECISION"
  ],
  "rationale": "Pending human review; replace this placeholder with the review rationale.",
  "reviewed_at": "1970-01-01T00:00:00Z",
  "machine_confidence_at_review": 0.815,
  "machine_route_at_review": "HUMAN_REVIEW_REQUIRED",
  "corrections": [],
  "source_commit": null
}
