{
  "schema": "prompt-quarry-human-review-v1",
  "review_id": "review-f089dd88766a19c2b1c1",
  "candidate_id": "cand-f089dd88766a19c2b1c1",
  "candidate_fingerprint": "sha256:c426d0ea84fbd14a65126c87620a55055ce7e88536aa11c4cb7ea20baa213206",
  "policy_version": "1.1.0",
  "reviewer_role": "human-owner",
  "decision": "HOLD",
  "decision_reason_codes": [
    "PENDING_HUMAN_DECISION"
  ],
  "rationale": "Pending human review; replace this placeholder with the review rationale.",
  "reviewed_at": "1970-01-01T00:00:00Z",
  "machine_confidence_at_review": 0.84,
  "machine_route_at_review": "HUMAN_REVIEW_REQUIRED",
  "corrections": [],
  "source_commit": null
}
