{
  "schema": "prompt-quarry-human-review-v1",
  "review_id": "review-eaeb224e54728f0b341c",
  "candidate_id": "cand-eaeb224e54728f0b341c",
  "candidate_fingerprint": "sha256:83534a10eadafddb3c734765a38a4a31f25b3fadbdba27298e240943f8ac7aec",
  "policy_version": "1.1.0",
  "reviewer_role": "human-owner",
  "decision": "HOLD",
  "decision_reason_codes": [
    "PENDING_HUMAN_DECISION"
  ],
  "rationale": "Pending human review; replace this placeholder with the review rationale.",
  "reviewed_at": "1970-01-01T00:00:00Z",
  "machine_confidence_at_review": 0.905,
  "machine_route_at_review": "HUMAN_REVIEW_REQUIRED",
  "corrections": [],
  "source_commit": null
}
