{
  "schema": "prompt-quarry-human-review-v1",
  "review_id": "review-8caeaf440949d7ab1392",
  "candidate_id": "cand-8caeaf440949d7ab1392",
  "candidate_fingerprint": "sha256:1d95eac385f7cc4ed8258dcfe711847a713729574c2c48a7d27e1b921d4d2a67",
  "policy_version": "1.1.0",
  "reviewer_role": "human-owner",
  "decision": "HOLD",
  "decision_reason_codes": [
    "PENDING_HUMAN_DECISION"
  ],
  "rationale": "Pending human review; replace this placeholder with the review rationale.",
  "reviewed_at": "1970-01-01T00:00:00Z",
  "machine_confidence_at_review": 0.92,
  "machine_route_at_review": "HUMAN_REVIEW_REQUIRED",
  "corrections": [],
  "source_commit": null
}
