{
  "schema": "prompt-quarry-human-review-v1",
  "review_id": "review-5e0106194e64c60d023a",
  "candidate_id": "cand-5e0106194e64c60d023a",
  "candidate_fingerprint": "sha256:670b39457a7ef2e35ce145c5c70e840c2d92ff24518644f8c5bdd7b631896267",
  "policy_version": "1.1.0",
  "reviewer_role": "human-owner",
  "decision": "HOLD",
  "decision_reason_codes": [
    "PENDING_HUMAN_DECISION"
  ],
  "rationale": "Pending human review; replace this placeholder with the review rationale.",
  "reviewed_at": "1970-01-01T00:00:00Z",
  "machine_confidence_at_review": 0.84,
  "machine_route_at_review": "HUMAN_REVIEW_REQUIRED",
  "corrections": [],
  "source_commit": null
}
