{
  "schema": "prompt-quarry-human-review-v1",
  "review_id": "review-64cdcf57331122b1df16",
  "candidate_id": "cand-64cdcf57331122b1df16",
  "candidate_fingerprint": "sha256:76a83b9ad177501e3f12250f781de66865c5486ae11c1eb53485afd4a6e7d214",
  "policy_version": "1.1.0",
  "reviewer_role": "human-owner",
  "decision": "HOLD",
  "decision_reason_codes": [
    "PENDING_HUMAN_DECISION"
  ],
  "rationale": "Pending human review; replace this placeholder with the review rationale.",
  "reviewed_at": "1970-01-01T00:00:00Z",
  "machine_confidence_at_review": 0.905,
  "machine_route_at_review": "HUMAN_REVIEW_REQUIRED",
  "corrections": [],
  "source_commit": null
}
