{
  "schema": "prompt-quarry-human-review-v1",
  "review_id": "review-be29e5f0eccc9561bf96",
  "candidate_id": "cand-be29e5f0eccc9561bf96",
  "candidate_fingerprint": "sha256:426f6992ac679e75cd3541a14c7f8d056f42438de125d3998f8d7936543b8af5",
  "policy_version": "1.1.0",
  "reviewer_role": "human-owner",
  "decision": "HOLD",
  "decision_reason_codes": [
    "PENDING_HUMAN_DECISION"
  ],
  "rationale": "Pending human review; replace this placeholder with the review rationale.",
  "reviewed_at": "1970-01-01T00:00:00Z",
  "machine_confidence_at_review": 0.92,
  "machine_route_at_review": "HUMAN_REVIEW_REQUIRED",
  "corrections": [],
  "source_commit": null
}
