{
  "schema": "prompt-quarry-human-review-v1",
  "review_id": "review-c3554ebc7f6b8a6fa104",
  "candidate_id": "cand-c3554ebc7f6b8a6fa104",
  "candidate_fingerprint": "sha256:ff60b99d6aceed8930401ac4c77a2bcbbcc66b377c2e26806d83a38b4bef4352",
  "policy_version": "1.1.0",
  "reviewer_role": "human-owner",
  "decision": "HOLD",
  "decision_reason_codes": [
    "PENDING_HUMAN_DECISION"
  ],
  "rationale": "Pending human review; replace this placeholder with the review rationale.",
  "reviewed_at": "1970-01-01T00:00:00Z",
  "machine_confidence_at_review": 0.88,
  "machine_route_at_review": "HUMAN_REVIEW_REQUIRED",
  "corrections": [],
  "source_commit": null
}
