{
  "schema": "prompt-quarry-human-review-v1",
  "review_id": "review-f5cc58a1be11add91ec3",
  "candidate_id": "cand-f5cc58a1be11add91ec3",
  "candidate_fingerprint": "sha256:5e473d0e1ae13f686c02aa3eac76e1282f1e602b75c6c2176edc30ede7c6294c",
  "policy_version": "1.1.0",
  "reviewer_role": "human-owner",
  "decision": "HOLD",
  "decision_reason_codes": [
    "PENDING_HUMAN_DECISION"
  ],
  "rationale": "Pending human review; replace this placeholder with the review rationale.",
  "reviewed_at": "1970-01-01T00:00:00Z",
  "machine_confidence_at_review": 0.86,
  "machine_route_at_review": "HUMAN_REVIEW_REQUIRED",
  "corrections": [],
  "source_commit": null
}
