{
  "schema": "prompt-quarry-human-review-v1",
  "review_id": "review-1e7085cd2b34ee170624",
  "candidate_id": "cand-1e7085cd2b34ee170624",
  "candidate_fingerprint": "sha256:965b68287558700372d766a0f9427728d4e502ca471e1dfd24d171595a8580c3",
  "policy_version": "1.1.0",
  "reviewer_role": "human-owner",
  "decision": "HOLD",
  "decision_reason_codes": [
    "PENDING_HUMAN_DECISION"
  ],
  "rationale": "Pending human review; replace this placeholder with the review rationale.",
  "reviewed_at": "1970-01-01T00:00:00Z",
  "machine_confidence_at_review": 0.905,
  "machine_route_at_review": "HUMAN_REVIEW_REQUIRED",
  "corrections": [],
  "source_commit": null
}
