{
  "schema": "prompt-quarry-human-review-v1",
  "review_id": "review-ea55c35d1d48bca79f85",
  "candidate_id": "cand-ea55c35d1d48bca79f85",
  "candidate_fingerprint": "sha256:a2524f1de7e66864a10a6d051b8d2cdd4814486a773bb4b793547acf3bfbcca2",
  "policy_version": "1.1.0",
  "reviewer_role": "human-owner",
  "decision": "HOLD",
  "decision_reason_codes": [
    "PENDING_HUMAN_DECISION"
  ],
  "rationale": "Pending human review; replace this placeholder with the review rationale.",
  "reviewed_at": "1970-01-01T00:00:00Z",
  "machine_confidence_at_review": 0.93,
  "machine_route_at_review": "HUMAN_REVIEW_REQUIRED",
  "corrections": [],
  "source_commit": null
}
