{
  "schema": "prompt-quarry-human-review-v1",
  "review_id": "review-9cb5465708a6dba0381a",
  "candidate_id": "cand-9cb5465708a6dba0381a",
  "candidate_fingerprint": "sha256:a7c452adfe86a8077bc26f789fbe1425284f51b071e82b3119a767201bb85e32",
  "policy_version": "1.1.0",
  "reviewer_role": "human-owner",
  "decision": "HOLD",
  "decision_reason_codes": [
    "PENDING_HUMAN_DECISION"
  ],
  "rationale": "Pending human review; replace this placeholder with the review rationale.",
  "reviewed_at": "1970-01-01T00:00:00Z",
  "machine_confidence_at_review": 0.915,
  "machine_route_at_review": "HUMAN_REVIEW_REQUIRED",
  "corrections": [],
  "source_commit": null
}
