{
  "schema": "prompt-quarry-human-review-v1",
  "review_id": "review-3dd6ea6394e4d088e9e4",
  "candidate_id": "cand-3dd6ea6394e4d088e9e4",
  "candidate_fingerprint": "sha256:cfeacf1bcd89bd2e74d5cf97ce3ff73cefab396c5f50ba356f0fe6024ae0db81",
  "policy_version": "1.1.0",
  "reviewer_role": "human-owner",
  "decision": "HOLD",
  "decision_reason_codes": [
    "PENDING_HUMAN_DECISION"
  ],
  "rationale": "Pending human review; replace this placeholder with the review rationale.",
  "reviewed_at": "1970-01-01T00:00:00Z",
  "machine_confidence_at_review": 0.89,
  "machine_route_at_review": "HUMAN_REVIEW_REQUIRED",
  "corrections": [],
  "source_commit": null
}
