{
  "schema": "prompt-quarry-human-review-v1",
  "review_id": "review-a7b9c0782ca16136a4ed",
  "candidate_id": "cand-a7b9c0782ca16136a4ed",
  "candidate_fingerprint": "sha256:c75ba2e510222724dc44685f1e9cbc4d156f7e796024c6db1b20e3632464f20e",
  "policy_version": "1.1.0",
  "reviewer_role": "human-owner",
  "decision": "HOLD",
  "decision_reason_codes": [
    "PENDING_HUMAN_DECISION"
  ],
  "rationale": "Pending human review; replace this placeholder with the review rationale.",
  "reviewed_at": "1970-01-01T00:00:00Z",
  "machine_confidence_at_review": 0.89,
  "machine_route_at_review": "HUMAN_REVIEW_REQUIRED",
  "corrections": [],
  "source_commit": null
}
