{
  "schema": "prompt-quarry-human-review-v1",
  "review_id": "review-556670bdba9c2dd9348a",
  "candidate_id": "cand-556670bdba9c2dd9348a",
  "candidate_fingerprint": "sha256:cb770b208fe5df45ab69168f2d37f2b4c40a19a017558d7358c81ec0cd07682d",
  "policy_version": "1.1.0",
  "reviewer_role": "human-owner",
  "decision": "HOLD",
  "decision_reason_codes": [
    "PENDING_HUMAN_DECISION"
  ],
  "rationale": "Pending human review; replace this placeholder with the review rationale.",
  "reviewed_at": "1970-01-01T00:00:00Z",
  "machine_confidence_at_review": 0.88,
  "machine_route_at_review": "HUMAN_REVIEW_REQUIRED",
  "corrections": [],
  "source_commit": null
}
