{
  "schema": "prompt-quarry-human-review-v1",
  "review_id": "review-99f8aabdd8525dc6b8d7",
  "candidate_id": "cand-99f8aabdd8525dc6b8d7",
  "candidate_fingerprint": "sha256:d8ec509bde88f705e29e47378f1b3d88374f9e81b73ec82a5020720623fea3c6",
  "policy_version": "1.1.0",
  "reviewer_role": "human-owner",
  "decision": "HOLD",
  "decision_reason_codes": [
    "PENDING_HUMAN_DECISION"
  ],
  "rationale": "Pending human review; replace this placeholder with the review rationale.",
  "reviewed_at": "1970-01-01T00:00:00Z",
  "machine_confidence_at_review": 0.84,
  "machine_route_at_review": "HUMAN_REVIEW_REQUIRED",
  "corrections": [],
  "source_commit": null
}
