{
  "schema": "prompt-quarry-human-review-v1",
  "review_id": "review-b1906dca5eb15b222ff5",
  "candidate_id": "cand-b1906dca5eb15b222ff5",
  "candidate_fingerprint": "sha256:d7959024e9300a17109d44de6280ae7c16f0241b62e629691f7c5e1f9594415a",
  "policy_version": "1.1.0",
  "reviewer_role": "human-owner",
  "decision": "HOLD",
  "decision_reason_codes": [
    "PENDING_HUMAN_DECISION"
  ],
  "rationale": "Pending human review; replace this placeholder with the review rationale.",
  "reviewed_at": "1970-01-01T00:00:00Z",
  "machine_confidence_at_review": 0.84,
  "machine_route_at_review": "HUMAN_REVIEW_REQUIRED",
  "corrections": [],
  "source_commit": null
}
