{
  "schema": "prompt-quarry-human-review-v1",
  "review_id": "review-df96034935dbb7dfad80",
  "candidate_id": "cand-df96034935dbb7dfad80",
  "candidate_fingerprint": "sha256:982c325fb7732b9c0b28aca908894cd97e9dfe266700ce1bfd6853a52e03a76c",
  "policy_version": "1.1.0",
  "reviewer_role": "human-owner",
  "decision": "HOLD",
  "decision_reason_codes": [
    "PENDING_HUMAN_DECISION"
  ],
  "rationale": "Pending human review; replace this placeholder with the review rationale.",
  "reviewed_at": "1970-01-01T00:00:00Z",
  "machine_confidence_at_review": 0.94,
  "machine_route_at_review": "HUMAN_REVIEW_REQUIRED",
  "corrections": [],
  "source_commit": null
}
