{
  "schema": "prompt-quarry-human-review-v1",
  "review_id": "review-4badcc300667b6ab022f",
  "candidate_id": "cand-4badcc300667b6ab022f",
  "candidate_fingerprint": "sha256:e2d5b26f76ce1953eb807c0bbaaf54e4234888f8554ab07cc3aeda9eca04dbc2",
  "policy_version": "1.1.0",
  "reviewer_role": "human-owner",
  "decision": "HOLD",
  "decision_reason_codes": [
    "PENDING_HUMAN_DECISION"
  ],
  "rationale": "Pending human review; replace this placeholder with the review rationale.",
  "reviewed_at": "1970-01-01T00:00:00Z",
  "machine_confidence_at_review": 0.915,
  "machine_route_at_review": "HUMAN_REVIEW_REQUIRED",
  "corrections": [],
  "source_commit": null
}
